ID,Breed,Description,Score
51685202,German Shepherd Dog,"Meet Ava, a 4-year-old spayed female German Shepherd. Ava is a beautiful girl who has some very specific behavioral needs...",0.2125,0.3322916666666667
51685203,Pit Bull Terrier,Beauty has boundless energy and is very affectionate and playful. She&amp;#39;s had some basic training but can be excited and...,0.09375,0.46875
51685206,Great Pyrenees,Casper is a sweet and gentle giant. He was brought to us because he needed more space than his previous...,0.1766666666666667,0.6233333333333333
51685208,Labrador Retriever,"Hobbs is sweeter than honey! A happy, very friendly, gentle guy who loves people and treats. He also loves pets,...",0.49583333333333335,0.8166666666666668
51685210,Staffordshire Bull Terrier,"Baby can be shy at first, but will quickly warm up (maybe if a treat is involved . . ....",0.11666666666666665,0.4777777777777777
51685213,Pit Bull Terrier,"Im Syfer! I am a big 5 yr old, gentle boy with lots of love to give! I love car...",0.28500000000000003,0.4600000000000001
51685215,Labrador Retriever,"Hooch is the greatest of the great! He&amp;#39;s very sweet, very playful, friendly and affectionate. He absolutely loves to play...",0.5383333333333334,0.7158333333333333
51685225,Staffordshire Bull Terrier,She is a high energy dog that would love an active home. She is very playful and loves to play...,0.1816666666666667,0.5099999999999999
51685228,Doberman Pinscher,Mac is an energetic guy with a fun personality! He can be shy at first and needs extra time to...,0.125,0.32666666666666666
51685234,Australian Cattle Dog / Blue Heeler,"Sky is a beautiful and sensitive girl who needs a gentle, reassuring owner willing to give her extra time and...",0.27999999999999997,0.7100000000000001
51685236,Pit Bull Terrier,Tyger is a handsome boy who would love an active owner to keep him busy! He can be jumpy and...,0.24791666666666667,0.625
51685238,Boxer,"Nala is very sweet with humans but who doesn&amp;#39;t always get along with other animals. As a result, she needs...",0.16499999999999998,0.6100000000000001
51685242,German Shepherd Dog,"Opal is a beautiful young shepherd looking for an adopter experienced with her breed, and ready to help train her...",0.4875,0.7
51685243,Poodle,"Sophie is an affectionate lady, who is looking to relax in her golden years. She was brought to us after...",0.3,0.5
51685247,Border Collie,"Nitro is a beautiful border collie who would love an owner who is home with him lots of the time,...",0.675,0.8
51685249,Boxer,"Look at that smirk! Daisy is a sweet, quirky girl with a fun personality! She is very energetic and is...",0.34375,0.625
51685230,Catahoula Leopard Dog,He is your chill and relaxed companion. He is easy to leash and would love to walk around and check...,0.4666666666666667,0.7166666666666667
51684836,Jindo,Zoey is a friendly girl waiting for her chance to have a family of her own.  She is good around...,0.5583333333333332,0.7000000000000001
51683684,Cattle Dog,"Pop Rocks is a little girl, parvo surviver. Date of birth March 9th 2021. This baby is spayed, chipped, bordetella...",-0.1875,0.5
51683488,Pit Bull Terrier,"Hercules is a sweet, but high energy guy, and has been known to jump and mouth when too excited. He...",0.295,0.6466666666666666
51683554,Border Collie,Hi! I am Baba. I am a sweet boy with a great history with kids. I get excited when I...,0.5083333333333333,0.7166666666666667
51683564,Plott Hound,Tessa is a sweet young girl full of life! She may not be a good fit for a home with...,0.39749999999999996,0.52
51683511,Australian Cattle Dog / Blue Heeler,He has a lot of puppy energy and puppy love to share with you family. This guy is very friendly...,0.49375,0.625
51683137,Labrador Retriever,"If you are interested in adopting, please visit our website and complete an adoption application at www.elpasocountycanine.org/adopt",0.175,0.45
51683066,Labrador Retriever,"*Due to concerns surrounding COVID-19, we have reformatted the way that we do adoptions in order to follow social distancing...",-0.04583333333333334,0.22083333333333333
51683065,Labrador Retriever,"MAMCO calls me Libby, but my foster calls me Mama. Ive had a lot happen in my life and have...",0.0,0.0
51683024,Pug,,,
51683021,Pug,,,
51683022,Poodle,,,
51683023,Labrador Retriever,"Please meet Jethro! Hailing from Houston, Texas, this big boy weighs in at an approximate 75lbs; he is neutered, up-to-date...",-0.2,0.35
51683004,Norfolk Terrier,"0521041

I need a single family home with a fenced in yard!

I&amp;#39;m heartworm positive. Heartworm is NOT contagious. The...",0.0689935064935065,0.37987012987012986
51683003,Chihuahua,"0421017

This loveable little boy is Lock! He is an 8 week old Chihuahua mix. Lock is a tiny little...",-0.08046875,0.425
51683000,Beagle,"0421056

I need a single family home with a fenced in yard since I require lots of physical and mental...",-0.05714285714285714,0.18571428571428572
51682996,Beagle,"0421060

I need a single family home with a fenced in yard since I require lots of physical and mental...",-0.05714285714285714,0.18571428571428572
51682997,Chihuahua,"0421013

I&amp;#39;m heartworm positive. Heartworm is NOT contagious. The rescue covers the cost of treatment at the rescue&amp;#39;s vet. 

This...",0.22727272727272727,0.5454545454545454
51682992,Beagle,"0421055

I need a single family home with a fenced in yard since I require lots of physical and mental...",-0.05714285714285714,0.18571428571428572
51683001,Beagle,"0421062

I need a single family home with a fenced in yard since I require lots of physical and mental...",-0.05714285714285714,0.18571428571428572
